{
  "schema_version": 1,
  "updated_at": "2026-09-16T11:31:54.634Z",
  "guides": [
    {
      "id": "station",
      "title_ru": "Колонка с Алисой",
      "summary_ru": "Голосовой центр дома: музыка, ответы и управление умным домом одной фразой.",
      "capabilities_ru": "Алиса отвечает на вопросы, включает музыку и подкасты, ставит таймеры и управляет устройствами умного дома. На колонках с экраном — погода, видео и сценарии. Примеры: «Алиса, включи свет в гостиной», «Алиса, какая температура дома?», «Алиса, запусти пылесос». Многие станции работают как хаб Zigbee или Matter.",
      "setup_ru": "Подключите колонку к розетке и Wi‑Fi через приложение «Дом с Алисой», войдите в аккаунт Яндекса и при необходимости добавьте Zigbee‑ или Matter‑устройства.",
      "setup_steps_ru": [
        "Включите колонку и дождитесь приветствия Алисы",
        "Откройте приложение «Дом с Алисой» и подключите колонку к Wi‑Fi",
        "Войдите в тот же аккаунт Яндекса, что на телефоне",
        "При необходимости включите режим хаба в настройках станции",
        "Скажите: «Алиса, найди устройства» или добавьте устройство вручную",
        "Проверьте: «Алиса, включи свет» (если лампа уже в доме)"
      ],
      "related_devices_ru": "Хаб (если станция без Zigbee), телефон с «Дом с Алисой», лампы, розетки и датчики",
      "related_device_ids": [
        "phone",
        "hub",
        "light",
        "socket"
      ],
      "command_device_filter_id": "station",
      "image_url": "https://staging-api.alicecommands.ru/devices/v1/station.png",
      "action_url": "https://alice.yandex.ru/support/ru/station/",
      "sort_order": 10
    },
    {
      "id": "tv",
      "title_ru": "Умный телевизор с Алисой",
      "summary_ru": "Большой экран с голосом: контент, поиск и умный дом с пульта или колонки.",
      "capabilities_ru": "Голосовой поиск фильмов и сериалов, запуск приложений, управление умным домом с экрана ТВ. Примеры: «Алиса, найди комедию», «Алиса, включи свет», «Алиса, покажи камеру у двери». ТВ-приставки и ИК-пульты в экосистеме относятся к тому же сценарию просмотра — отдельной карточкой не дублируем.",
      "setup_ru": "Подключите телевизор к Wi‑Fi, войдите в аккаунт Яндекса в настройках ТВ или через приложение «Дом с Алисой».",
      "setup_steps_ru": [
        "Включите ТВ и подключите к домашнему Wi‑Fi",
        "Откройте настройки Яндекса / Алисы на телевизоре",
        "Войдите в аккаунт Яндекса",
        "Проверьте микрофон на пульте или привяжите колонку с тем же аккаунтом",
        "Убедитесь, что устройства умного дома видны в «Дом с Алисой»"
      ],
      "related_devices_ru": "Колонка с Алисой, телефон, камера для просмотра на ТВ",
      "related_device_ids": [
        "station",
        "phone",
        "camera"
      ],
      "command_device_filter_id": "tv",
      "image_url": "https://staging-api.alicecommands.ru/devices/v1/tv.png",
      "action_url": "https://alice.yandex.ru/support/ru/tv/",
      "sort_order": 20
    },
    {
      "id": "phone",
      "title_ru": "Алиса на смартфоне",
      "summary_ru": "Пульт умного дома в кармане: голос, сценарии и настройка устройств без колонки рядом.",
      "capabilities_ru": "Запуск Алисы кнопкой или фразой, управление лампами, розетками и сценариями, таймеры и напоминания. Примеры: «Алиса, я ушёл», «Алиса, выключи всё в спальне», «Алиса, включи чайник». Через «Дом с Алисой» добавляют устройства, комнаты и сценарии.",
      "setup_ru": "Установите «Яндекс» или «Дом с Алисой», войдите в аккаунт и разрешите микрофон.",
      "setup_steps_ru": [
        "Установите приложение «Дом с Алисой» (или «Яндекс»)",
        "Войдите в аккаунт Яндекса",
        "Разрешите доступ к микрофону и уведомлениям",
        "Добавьте дом и комнаты",
        "Привяжите колонку или хаб, если они уже есть"
      ],
      "related_devices_ru": "Колонка или ТВ с тем же аккаунтом, хаб для Zigbee‑устройств",
      "related_device_ids": [
        "station",
        "tv",
        "hub"
      ],
      "command_device_filter_id": "phone",
      "image_url": "https://staging-api.alicecommands.ru/devices/v1/phone.png",
      "action_url": "https://alice.yandex.ru/support/ru/alice-on-phone/",
      "sort_order": 30
    },
    {
      "id": "hub",
      "title_ru": "Хаб умного дома",
      "summary_ru": "Связывает Zigbee‑ и Matter‑устройства в одну систему с Алисой.",
      "capabilities_ru": "Хаб (отдельный или встроенный в станцию) принимает лампы, датчики, розетки и реле по Zigbee или Matter и отдаёт управление Алисе. Без хаба многие датчики и лампы «не видят» колонку. После подключения работают сценарии: свет по движению, уведомления о протечке, климат по датчику.",
      "setup_ru": "Выберите хаб Яндекса или станцию с поддержкой Zigbee/Matter, добавьте его в «Дом с Алисой» и подключайте устройства в режиме сопряжения.",
      "setup_steps_ru": [
        "Убедитесь, что хаб или станция поддерживает нужный протокол (Zigbee / Matter)",
        "Добавьте хаб в приложение «Дом с Алисой»",
        "Включите режим добавления устройства на хабе",
        "Переведите лампу или датчик в режим сопряжения по инструкции производителя",
        "Дождитесь появления устройства в приложении и назначьте комнату",
        "Проверьте голосом: «Алиса, что с [имя устройства]?»"
      ],
      "related_devices_ru": "Колонка-станция, лампы, розетки, датчики движения и протечки",
      "related_device_ids": [
        "light",
        "socket",
        "sensor_motion",
        "sensor_water_leak"
      ],
      "image_url": "https://staging-api.alicecommands.ru/devices/v1/hub.png",
      "action_url": "https://alice.yandex.ru/support/ru/smart-home/supported-zigbee-devices",
      "sort_order": 40
    },
    {
      "id": "light",
      "title_ru": "Свет",
      "summary_ru": "Лампы, ленты, люстры и светильники — включение, яркость и цвет голосом.",
      "capabilities_ru": "Один тип для всего освещения: лампочка, настольная лампа, люстра, бра, торшер, диодная лента, гирлянда, диммер. Алиса включает/выключает, меняет яркость, температуру белого и цвет (если устройство умеет). Примеры: «Алиса, включи свет в кухне», «Алиса, сделай свет теплее», «Алиса, ленту синим», «Алиса, выключи гирлянду». Подтипы платформы (light.lamp, light.strip и т.д.) в приложении — разные формы одного типа «Свет».",
      "setup_ru": "Подключите лампу или контроллер по Wi‑Fi, Zigbee или Matter через «Дом с Алисой»; для Zigbee нужен хаб или станция с хабом.",
      "setup_steps_ru": [
        "Вкрутите лампу или подключите ленту/контроллер к питанию",
        "Откройте «Дом с Алисой» → добавить устройство",
        "Выберите протокол (Wi‑Fi / Zigbee / Matter) и следуйте подсказкам",
        "При Zigbee включите режим сопряжения на хабе",
        "Назовите устройство и укажите комнату",
        "Проверьте: «Алиса, включи [имя]»"
      ],
      "related_devices_ru": "Хаб, выключатель, датчик движения для автосвета, колонка",
      "related_device_ids": [
        "hub",
        "switch",
        "sensor_motion"
      ],
      "image_url": "https://staging-api.alicecommands.ru/devices/v1/light.png",
      "action_url": "https://yandex.ru/dev/dialogs/smart-home/doc/ru/concepts/device-type-light",
      "sort_order": 50
    },
    {
      "id": "socket",
      "title_ru": "Умная розетка",
      "summary_ru": "Включает и выключает обычные приборы через Алису — без замены самой техники.",
      "capabilities_ru": "Розетка с on/off (иногда с измерением потребления). Удобна для торшера, гирлянды, обогревателя, зарядки. В «Дом с Алисой» тип можно сменить на «Свет», если в розетку воткнут светильник — тогда сработают команды про свет. Примеры: «Алиса, включи розетку у ёлки», «Алиса, выключи обогреватель».",
      "setup_ru": "Вставьте розетку в сеть, добавьте в «Дом с Алисой» (Wi‑Fi, Zigbee или Matter).",
      "setup_steps_ru": [
        "Вставьте умную розетку в обычную розетку",
        "Включите режим сопряжения по инструкции",
        "Добавьте устройство в «Дом с Алисой»",
        "Подключите нужный прибор в умную розетку",
        "При необходимости смените тип на «Свет» в настройках устройства",
        "Проверьте: «Алиса, включи [имя розетки]»"
      ],
      "related_devices_ru": "Хаб, свет (если розетка питает лампу), реле, колонка",
      "related_device_ids": [
        "hub",
        "light",
        "switch"
      ],
      "image_url": "https://staging-api.alicecommands.ru/devices/v1/socket.png",
      "action_url": "https://yandex.ru/dev/dialogs/smart-home/doc/ru/concepts/device-type-socket",
      "sort_order": 60
    },
    {
      "id": "switch",
      "title_ru": "Выключатель и реле",
      "summary_ru": "Настенные выключатели и реле в щитке — свет и нагрузка без умных ламп в каждой точке.",
      "capabilities_ru": "Объединяет настенный выключатель/тумблер и умное реле (автомат в щитке). Управляет линиями освещения и нагрузкой, часто вместе с обычными лампами. Примеры: «Алиса, включи свет в коридоре», «Алиса, выключи люстру». Реле удобно, когда нельзя менять проводку у выключателя.",
      "setup_ru": "Монтаж по инструкции производителя (часто нужен электрик), затем сопряжение с хабом в «Дом с Алисой».",
      "setup_steps_ru": [
        "Отключите питание линии перед монтажом",
        "Установите выключатель или реле по схеме производителя",
        "Подайте питание и переведите устройство в режим сопряжения",
        "Добавьте в «Дом с Алисой» через хаб (обычно Zigbee)",
        "Привяжите к комнате и сценариям",
        "Проверьте голосом и с кнопки на стене"
      ],
      "related_devices_ru": "Хаб, свет, датчик движения, розетка",
      "related_device_ids": [
        "hub",
        "light",
        "sensor_motion",
        "socket"
      ],
      "image_url": "https://staging-api.alicecommands.ru/devices/v1/switch.png",
      "action_url": "https://yandex.ru/dev/dialogs/smart-home/doc/ru/concepts/device-type-switch",
      "sort_order": 70
    },
    {
      "id": "sensor_motion",
      "title_ru": "Датчик движения",